{
  "schema_version": 1,
  "request_id": "11111111-1111-4111-8111-111111111111",
  "actual_environment": "DEV",
  "policy_version": 1,
  "status": "DENIED",
  "result": null,
  "affected_rows": null,
  "truncated": false,
  "elapsed_ms": 15,
  "audit_reference": "synthetic-audit-1",
  "error_code": "SCOPE_DENIED",
  "message": "Synthetic denied response",
  "commit_state": "not-applicable",
  "retry_safe": false
}
