{
  "schema_version": 1,
  "request_id": "11111111-1111-4111-8111-111111111111",
  "actual_environment": "DEV",
  "policy_version": 1,
  "status": "UNCERTAIN_COMMIT",
  "result": null,
  "affected_rows": null,
  "truncated": false,
  "elapsed_ms": 15,
  "audit_reference": "synthetic-audit-1",
  "error_code": "COMMIT_OUTCOME_UNKNOWN",
  "message": "Verify request status before any resend",
  "commit_state": "unknown",
  "retry_safe": false
}
